{
  "$schema": "https://json-schema.org/draft/2020-12/schema",
  "$id": "https://irodora.com/schemas/mockup-inventory.schema.json",
  "title": "Irodora mockup element inventory",
  "description": "Golden rule 14, per element (F-220). One file per image in mockups/: every element the image draws, top to bottom, with its measured geometry, token, face, icon, binding and action. The text an image prints is not recorded as an element's content (R9-MOCKUP-FIDELITY §4 E1) — only its shape and script; a departure's why may quote the drawn construction it departs from. Generated from mockups/tools/inventory-data/NN.mjs by mockups/tools/generate-inventory.mjs; checked by scripts/verify-mockups.mjs, which reads its vocabulary from this file. The rules it applies are R9-MOCKUP-FIDELITY §2–§8.",
  "type": "object",
  "additionalProperties": false,
  "required": [
    "mockup",
    "mockupSha256",
    "kind",
    "governs",
    "frame",
    "elements",
    "notDesign",
    "departures",
    "conflicts"
  ],
  "properties": {
    "$schema": {
      "type": "string"
    },
    "mockup": {
      "type": "string",
      "pattern": "^[0-9]{2}$",
      "description": "The image's number; its file is the mockups/index.json row of the same id."
    },
    "mockupSha256": {
      "type": "string",
      "pattern": "^[0-9a-f]{64}$",
      "description": "The sha256 of the image this inventory was written against. It must equal the index row's sha256, or the elements may no longer be the ones drawn (E-126)."
    },
    "kind": {
      "enum": ["screen", "board"],
      "description": "screen: one route (or one state of one), measured at §2's scale. board: a sheet of components, a brand board or a states board — it fixes the vocabulary screens reference, and a screen wins where the two disagree (P3)."
    },
    "governs": {
      "enum": ["layout", "palette", "locale", "state", "vocabulary"],
      "description": "What this image decides (§3). layout: a primary mockup (P1). palette / locale / state: a variant, which governs only that dimension of the route it varies (P2). vocabulary: a board (P3)."
    },
    "frame": {
      "type": "object",
      "additionalProperties": false,
      "required": ["kind", "screens"],
      "properties": {
        "kind": {
          "enum": ["full-bleed", "device", "spec-card", "board"]
        },
        "screens": {
          "type": "array",
          "minItems": 1,
          "description": "The drawn screen(s) in image pixels, and the scale that maps each to the 384 dp reference (§2). A board may draw several devices; a full-bleed image has one screen, the whole width.",
          "items": {
            "type": "object",
            "additionalProperties": false,
            "required": ["id", "box", "dpPerPx"],
            "properties": {
              "id": {
                "type": "string",
                "pattern": "^[0-9]{2}\\.[a-z0-9-]+$"
              },
              "box": {
                "$ref": "#/$defs/box"
              },
              "dpPerPx": {
                "oneOf": [
                  {
                    "type": "number",
                    "exclusiveMinimum": 0
                  },
                  {
                    "type": "null"
                  }
                ],
                "description": "384 / the screen's inner width in px. null on a board sheet, which draws components at no screen's scale — its elements carry dp: null, and a screen decides their size (P3)."
              }
            }
          }
        }
      }
    },
    "elements": {
      "type": "array",
      "items": {
        "$ref": "#/$defs/element"
      },
      "minItems": 1
    },
    "notDesign": {
      "type": "array",
      "description": "Presentation artefacts (§2) — bezels, status bars, callouts, leaked prompt labels, garbled text, line-art outside a frame. Listed so that no feature builds one.",
      "items": {
        "type": "object",
        "additionalProperties": false,
        "required": ["what", "box"],
        "properties": {
          "what": {
            "enum": [
              "bezel",
              "status-bar",
              "callout",
              "leaked-label",
              "garbled-text",
              "outside-art",
              "board-annotation",
              "presentation"
            ],
            "description": "presentation: what the OS or the render's setting draws and no surface of the app does — a home indicator, the home screen an icon sits on, a faint mark in the render."
          },
          "note": {
            "type": "string"
          },
          "box": {
            "$ref": "#/$defs/box"
          }
        }
      }
    },
    "departures": {
      "type": "array",
      "description": "Every place the build will not draw what the image draws. A departure exists only if R9-MOCKUP-FIDELITY §4 lists its rule (golden rule 14).",
      "items": {
        "type": "object",
        "additionalProperties": false,
        "required": ["rule", "element", "why"],
        "properties": {
          "rule": {
            "enum": ["E1", "E2", "E3", "E4"]
          },
          "element": {
            "$ref": "#/$defs/elementId"
          },
          "why": {
            "type": "string",
            "minLength": 12
          }
        }
      }
    },
    "conflicts": {
      "type": "array",
      "description": "Each §6 conflict that touches this image, the elements it decides, and whether the user flipped its default.",
      "items": {
        "type": "object",
        "additionalProperties": false,
        "required": ["id", "elements", "resolution", "flippedByUser"],
        "properties": {
          "id": {
            "type": "string",
            "pattern": "^C[0-9]{1,2}$"
          },
          "elements": {
            "type": "array",
            "items": {
              "$ref": "#/$defs/elementId"
            }
          },
          "resolution": {
            "type": "string",
            "minLength": 12
          },
          "flippedByUser": {
            "type": "boolean"
          }
        }
      }
    },
    "overhangs": {
      "type": "array",
      "description": "Elements the image draws past its own screen's edge, each recorded as drawn only while an open question in PRD §10 asks what to build (fit it to the screen, or keep the drawn width). A child of a declared element overhangs through it. The record never decides the question.",
      "items": {
        "type": "object",
        "additionalProperties": false,
        "required": ["element", "question"],
        "properties": {
          "element": {
            "$ref": "#/$defs/elementId"
          },
          "question": {
            "type": "string",
            "pattern": "^OQ-[0-9]+$"
          }
        }
      }
    }
  },
  "$defs": {
    "box": {
      "type": "object",
      "additionalProperties": false,
      "required": ["x", "y", "w", "h"],
      "properties": {
        "x": {
          "type": "integer",
          "minimum": 0
        },
        "y": {
          "type": "integer",
          "minimum": 0
        },
        "w": {
          "type": "integer",
          "minimum": 1
        },
        "h": {
          "type": "integer",
          "minimum": 1
        }
      }
    },
    "dp": {
      "type": "object",
      "additionalProperties": false,
      "required": ["x", "y", "w", "h"],
      "properties": {
        "x": {
          "type": "number"
        },
        "y": {
          "type": "number"
        },
        "w": {
          "type": "number",
          "minimum": 0
        },
        "h": {
          "type": "number",
          "minimum": 0
        }
      }
    },
    "elementId": {
      "type": "string",
      "pattern": "^[0-9]{2}(\\.[a-z0-9-]+)+$"
    },
    "element": {
      "type": "object",
      "additionalProperties": false,
      "required": [
        "id",
        "order",
        "parent",
        "component",
        "box",
        "dp",
        "tokens",
        "type",
        "icon",
        "illustration",
        "binding",
        "action",
        "copy"
      ],
      "properties": {
        "id": {
          "$ref": "#/$defs/elementId"
        },
        "order": {
          "type": "integer",
          "minimum": 1,
          "description": "A strict sequence within the file. A screen reads top to bottom, then left to right: elements sorted by top edge, where consecutive tops within 8 px (4 dp) chain into one row, and each row is read left to right. A board reads panel by panel — column by column, each column top to bottom — because its columns are unrelated groups, not one page."
        },
        "parent": {
          "oneOf": [
            {
              "$ref": "#/$defs/elementId"
            },
            {
              "type": "null"
            }
          ]
        },
        "screen": {
          "type": "string",
          "pattern": "^[0-9]{2}\\.[a-z0-9-]+$",
          "description": "Which of frame.screens the element sits in — required where the image draws more than one. dp is measured from that screen's origin at its dpPerPx."
        },
        "component": {
          "oneOf": [
            {
              "type": "string",
              "pattern": "^(ui|new|app):[A-Z][A-Za-z0-9.]*$"
            },
            {
              "type": "null"
            }
          ],
          "description": "ui:<export of @irodora/ui>, new:<a component a feature must add to it>, or app:<a screen-local composition>. null for a pure container. A ui:Button with an icon, no copy on itself or any child, and a bg or border token is Button's icon-only form: the plate is the pressable. With neither, it is IconButton — the glyph alone (ADR-0115)."
        },
        "box": {
          "$ref": "#/$defs/box"
        },
        "dp": {
          "oneOf": [
            {
              "$ref": "#/$defs/dp"
            },
            {
              "type": "null"
            }
          ],
          "description": "The box at §2's scale — (box − screen origin) × dpPerPx, to the nearest half dp. Not snapped to the R9 scale: a token is chosen from it, it is not one. null on a board, where the render's scale is not a screen's."
        },
        "tokens": {
          "type": "object",
          "description": "Role → §5 token, e.g. { \"bg\": \"level1\", \"fg\": \"text.primary\", \"radius\": \"lg\", \"border\": \"border.subtle\" }.",
          "additionalProperties": {
            "type": "string",
            "pattern": "^[a-z][A-Za-z0-9.]*$"
          }
        },
        "type": {
          "oneOf": [
            {
              "type": "object",
              "additionalProperties": false,
              "required": ["face", "size", "weight"],
              "properties": {
                "face": {
                  "enum": ["serif", "sans", "mincho", "gothic"]
                },
                "size": {
                  "enum": [
                    "display1",
                    "title",
                    "body",
                    "label",
                    "caption",
                    "wordmark",
                    "wordmarkSplash"
                  ],
                  "description": "A §5 step. caption marks an em measured below 12 dp, where §5 names no step (OQ-12 asks whether to add one); raw.emDp keeps the estimate. Siblings drawn alike take one step — the one most of them snap to, the smaller on a tie (§2)."
                },
                "weight": {
                  "enum": [300, 400, 500, 600, 700]
                },
                "tabular": {
                  "type": "boolean"
                }
              }
            },
            {
              "type": "null"
            }
          ]
        },
        "icon": {
          "oneOf": [
            {
              "type": "string",
              "pattern": "^[a-z][a-z0-9-]*$"
            },
            {
              "type": "null"
            }
          ]
        },
        "illustration": {
          "oneOf": [
            {
              "type": "string",
              "pattern": "^[a-z][a-z0-9-]*$"
            },
            {
              "type": "null"
            }
          ]
        },
        "binding": {
          "oneOf": [
            {
              "type": "string",
              "pattern": "^(static|engine|corpus|store|derived|route|oq):[^\\s]+$"
            },
            {
              "type": "null"
            }
          ],
          "description": "§8. static:<i18n key> · engine:<function> · corpus:<field> · store:<field> · derived:<feature> · route:<param> · oq:<OQ id>. null only for pure decoration, and on a board, whose samples show a component and bind nothing."
        },
        "action": {
          "oneOf": [
            {
              "type": "string",
              "pattern": "^(navigate|open|toggle|select|adjust|submit|dismiss|share|capture):[^\\s]*$"
            },
            {
              "type": "null"
            }
          ]
        },
        "measured": {
          "type": "object",
          "description": "Optional. Role → the hex actually read from the render (§2's method, ΔE00 ≈ 2 tolerance), kept for the appearance sweep (F-221). The token above is what the build uses (P4); this records how far the render sat from it.",
          "additionalProperties": {
            "type": "string",
            "pattern": "^#[0-9A-F]{6}$"
          }
        },
        "raw": {
          "type": "object",
          "description": "Optional. Readings kept beside a snapped value so a reviewer can see what the snap changed: emDp, the estimated em in dp (§2's glyph-class rule) wherever the size step moved it by more than 2 dp or the step is caption; cornerPx, a fitted corner radius in image px wherever the radius token moved it by more than 2 dp or the image has no scale; trackPx and thumbPx, a control's track thickness and thumb diameter in image px, from which its drawn sizes come; glyphPx, a glyph's drawn width in image px inside its plate (F-232); ringPx and gapPx, an anchor ring's width and its gap to the sample (F-233); toothPx and pitchPx, a pinked edge's tooth depth and the distance between its tips (F-233); keylinePx, the width of the line around a sample where it is wider than a hairline (F-233); rulePx and belowLabelsPx, a tab bar's top rule and the space under its labels, and filled, a glyph drawn filled rather than outlined (F-234); sweepDeg, gapDeg and fillDeg, an open dial's arc, gap and filled arc in degrees on its centre line, with radiusPx and strokePx; rings, spokePx, edgePx and markerPx, a radar's ring count and its line, edge and marker widths; activePx, dotPx, smallPx and pitchPx, page dots' diameters and centre spacing (F-235); a blossom's petals, phaseDeg (its first petal from straight up), orbitPx, petalPx, hubPx, eyePx, ringOuterPx, stamenOuterPx, stamenPx, stamenTipPx, antherPx, seamPx and reachPx, and a word's inkHeightPx and inkWidthPx with markGapPx (from a mark's ink to its own) or gapAbovePx (from the ink above it) (F-230); a tile's gradientDeg (its axis, clockwise from vertical, lightest end first) and rimPx (an edge light the platform draws), a mark's centreDyPx and inkCentreDyPx (how far below its tile's centre its grid and its ink box sit), a glow's alpha and sigmaPx (a blur of the mark behind it), and a line's insetPx and footPx (from the screen's sides and foot) (F-231).",
          "additionalProperties": {
            "type": "number"
          }
        },
        "copy": {
          "oneOf": [
            {
              "type": "object",
              "additionalProperties": false,
              "required": ["shape", "script"],
              "properties": {
                "shape": {
                  "enum": ["heading", "label", "value", "body", "caption", "placeholder", "badge"]
                },
                "script": {
                  "enum": ["latin", "japanese", "mixed", "figures"]
                },
                "lines": {
                  "type": "integer",
                  "minimum": 1
                }
              }
            },
            {
              "type": "null"
            }
          ],
          "description": "The shape of the text, never the text (E1)."
        }
      }
    }
  }
}
